{
  "$id": "ARTIFACT_MANIFEST_SCHEMA.json",
  "$schema": "https://json-schema.org/draft/2020-12/schema",
  "additionalProperties": false,
  "properties": {
    "artifacts": {
      "items": {
        "additionalProperties": false,
        "properties": {
          "path": {
            "minLength": 1,
            "type": "string"
          },
          "sha256": {
            "pattern": "^[0-9a-f]{64}$",
            "type": "string"
          },
          "size_bytes": {
            "minimum": 0,
            "type": "integer"
          }
        },
        "required": [
          "path",
          "sha256",
          "size_bytes"
        ],
        "type": "object"
      },
      "type": "array"
    },
    "manifest_excludes_itself": {
      "const": true
    },
    "request_id": {
      "minLength": 1,
      "type": "string"
    },
    "schema_version": {
      "const": "1.0"
    }
  },
  "required": [
    "schema_version",
    "request_id",
    "artifacts",
    "manifest_excludes_itself"
  ],
  "type": "object"
}
