{
  "artifacts": [
    {
      "path": "assertion_inventory.json",
      "sha256": "05e38209211d37a4e0b943f016330dda47d2480f75227d7cd6fe924a47f2ecb2",
      "size_bytes": 307
    },
    {
      "path": "assumption_inventory.json",
      "sha256": "2a4c2edda28728b8236ef985081820b0c2890cfc186a9a16e73c5b09e64ef514",
      "size_bytes": 277
    },
    {
      "path": "canonical_request.json",
      "sha256": "a181bbcb3917aa0a8333f783c2cc8451829a15cd7a0717b7532fce24aeb0f471",
      "size_bytes": 2144
    },
    {
      "path": "findings.json",
      "sha256": "1781f130b210d80e2dbc2fe4f4b9449e92738b8b4e4fe125e3650c4f4a639a1c",
      "size_bytes": 6257
    },
    {
      "path": "harness_integrity_audit_report.json",
      "sha256": "057b1db9af1c33f4194727003f903fca9ef34b4955f9fc0c8ec8aab58041e680",
      "size_bytes": 7151
    },
    {
      "path": "harness_integrity_audit_report.md",
      "sha256": "76550b50e66d229d730a5eb43ca6d83d8e33ed41c3479d53c67f5f95a78fe08f",
      "size_bytes": 3411
    },
    {
      "path": "source_manifest.json",
      "sha256": "20ec995b45b79d9af7f6e64caed054f9cbe3c5a6dd7fa77b3e679cbaf16d16fc",
      "size_bytes": 2608
    },
    {
      "path": "target_binding_report.json",
      "sha256": "9c151a1f7c2197915e634f70d84dfea4181a9cb5b3906a17df9d11f7069bcdde",
      "size_bytes": 322
    }
  ],
  "manifest_excludes_itself": true,
  "request_id": "vector-subtract-integrity-001",
  "schema_version": "1.0"
}
